书籍名,作者,出版日期,出版社,ISBN,PDF🔗
微观经济学：现代观点（第八版）,哈尔.R.范里安; 费方域; 朱保华,2015,格致出版社,,
微观经济学（第八版）,"Pindyck, Robert S.; Rubinfeld, Daniel L.",2013,中国人民大学出版社,978-7-300-17133-3,
"""计量经济学基础"" (第五版) 学生习题解答手册",古扎拉蒂; 波特; 费剑平; 王俊杰,2012,中国人民大学出版社,978-7-300-15091-8,
经济计量学精要（第四版）,"古扎拉蒂, 达摩达尔·N·",2011,中国人民大学出版社,978-7-300-13693-6,
微观经济学十八讲,平新乔,,,,
高级计量经济学及Stata应用（第二版）,陈强,2014,高等教育出版社,978-7-04-032983-4,
Using Python for Introductory Econometrics,"Heiss, Florian; Brunner, Daniel",2020,Independently published,9.79865E+12,
微观经济学(第19版),保罗·萨缪尔森; 威廉·诺德豪斯,2012,人民邮电出版社,978-7-115-26816-7,
Microeconomic Theory,"Mas-Colell, Andreu; Whinston, Michael D.; Green, Jerry R.",1995,Oxford University Press,978-0-19-507340-9,
计量经济学及Stata应用,陈强,2015,高等教育出版社,978-7-04-042751-6,
微观经济理论,安德鲁·马斯-克莱尔; 迈克尔·D·温斯顿; 杰里·R·格林,2014,中国人民大学出版社,978-7-300-19986-3,
微观经济理论：基本原理与扩展（第11版）,克里斯托弗·斯奈德; 沃尔特·尼科尔森,2015,北京大学出版社,978-7-301-26252-8,
西方经济学（微观部分）,高鸿业,2011,中国人民大学出版社,978-7-300-12801-6,
应用计量经济学,A.H.施图德蒙德,2007,机械工业出版社,978-7-111-20608-8,
计量经济学,庞皓,,,,
计量经济学入门,黄少敏,2004,北京大学出版社,978-7-301-07589-0,
概率论与统计学,洪永淼,2017,中国统计出版社,978-7-5037-8106-3,
统计学（第7版）,贾俊平; 何晓群; 金勇进,2018,中国人民大学出版社,978-7-300-25351-0,
统计学（第6版）,贾俊平; 何晓群; 金勇进,2015,中国人民大学出版社,978-7-300-20309-6,
经济学,保罗·萨缪尔森,2008,人民邮电出版社,978-7-115-17343-0,
微观经济理论(第9版),沃尔特·尼科尔森,2008,北京大学出版社,978-7-301-12289-1,
计量经济学,林文夫,2005,上海财经大学出版社,978-7-81098-499-7,
回归分析,谢宇,2010,社会科学文献出版社,978-7-5097-1601-4,
基本无害的计量经济学,"安格里斯特, 乔舒亚; 斯特芬•皮施克, 约恩",2012,格致出版社,978-7-5432-2058-4,
基本有用的计量经济学,赵西亮,2017,北京大学出版社,978-7-301-28481-0,
倾向值分析,郭申阳; 马克·W.弗雷泽,2012,重庆大学出版社,978-7-5624-6622-2,
面板数据计量经济分析,"巴尔塔基, 巴蒂·H",2010,机械工业出版社,978-7-111-30230-8,
经济理论中的最优化方法,"K.迪克西特, 阿维纳什",2006,上海世纪（上海人民）,978-7-208-06084-5,
PRICE THEORY AND APPLICATIONS,杰克.赫舒拉发; 阿米亥.格雷泽; 大卫.赫舒拉发,2009,机械工业出版社,978-7-111-25843-8,
计量经济学导论（第四版）,杰弗里·M·伍德里奇,2010,中国人民大学出版社,978-7-300-12319-6,
横截面与面板数据的经济计量分析,伍德里奇,2007,中国人民大学出版社,978-7-300-08090-1,
数理经济学的基本方法,蒋中一; 凯尔文·温赖特,2006,北京大学出版社,978-7-301-10004-2,
西方经济学（第七版）,高鸿业,2014,中国人民大学出版社,978-7-300-19496-7,
计量经济学原理,R·卡特·希尔; 威廉·E·格里菲思; 瓜伊·C·利姆,2013,东北财经大学出版社,978-7-5654-1038-3,
空间计量经济学,J·保罗·埃尔霍斯特,2015,中国人民大学出版社,978-7-300-21024-7,
"Microeconomic Analysis, Third Edition","Varian, Hal R.",1992,W. W. Norton & Company,978-0-393-95735-8,
经济学中的数学,卡尔·P·西蒙; 劳伦斯·布鲁姆,2012,中国人民大学出版社,978-7-300-16449-6,
宏观经济学(第9版),曼昆,,,,
高级微观经济理论,杰弗里·A·杰里; 菲利普·J·瑞尼,2012,中国人民大学出版社,978-7-300-16613-1,
罗默高级宏观经济学（第4版）课后习题详解,圣才考研网,2014,上海财经大学出版社,978-7-5642-2001-3,
宏观经济学二十五讲：中国视角,徐高,2019,中国人民大学出版社,978-7-300-26680-0,
金融经济学二十五讲,徐高,2018,中国人民大学出版社有限公司,978-7-300-25823-2,
Mastering Metrics,"Angrist, Joshua D.; Pischke, Jörn-Steffen",2014,Princeton University Press,978-0-691-15284-4,
高级宏观经济学入门导引,徐高,,,,
计量经济学原理,彼得·肯尼迪,2014,中国人民大学出版社,978-7-300-19342-7,
宏观经济学（第十二版）,鲁迪格·多恩布什; 斯坦利·费希尔,2017,中国人民大学出版社,978-7-300-23772-5,
中国主要统计指标诠释,国家统计局,2013,中国统计出版社,978-7-5037-6941-2,
微观经济学（第七版）,罗伯特·S·平狄克; 鲁宾菲尔德,2009,中国人民大学出版社,978-7-300-11073-8,
考博专业课真题与难题详解微观经济学（第4版）,圣才考研网,2013,中国石化出版社,978-7-5114-2202-6,
图解微观宏观经济学,华经,2012,,978-7-5096-1868-4,
微观经济计量学,A.科林·卡梅伦; 普拉温·K.特里维迪,2010,上海财经大学出版社,978-7-5642-0800-4,
政治经济学教程,宋涛,2008,中国人民大学,978-7-300-09292-8,
计量经济学（第四版）,李子奈; 潘文卿,2015,高等教育出版社,978-7-04-043432-3,
金融经济学原理,斯蒂芬·F.勒罗伊; 简·沃纳,2018,"格致出版社,上海人民出版社",978-7-5432-2799-6,
宏观经济学（第五版）,高鸿业,,,,
概率论基础教程（原书第9版）,"Ross, Sheldon M.",2014,机械工业出版社,978-7-111-44789-4,
统计学习基础,"Tibshirani, Robert; Hastie, Trevor; Friedman, Jerome",2004,电子工业出版社,978-7-5053-9331-8,
概率论与数理统计习题全解指南,盛骤; 谢式千; 潘承毅,2008,高等教育出版社,978-7-04-023898-3,
高等数学习题全解指南(上册第7版),,2014,高等教育出版社,978-7-04-039691-1,
高等数学习题全解指南(下册第7版),同济大学数学系,2014,高等教育出版社,978-7-04-039692-8,
高等数学·下册,同济大学数学系,2014,高等教育出版社,978-7-04-039662-1,
工程数学.线性代数,同济大学数学系,2007,高等教育出版社,978-7-04-021218-1,
工程数学.线性代数（第六版）,同济大学数学系,2014,高等教育出版社,978-7-04-039661-4,
线性代数附册学习辅导与习题全解,同济大学数学系,2007,高等教育出版社,978-7-04-021507-6,
宏观经济学,奥利维尔·布兰查德,2010,清华大学出版社,978-7-302-21954-5,
微观经济学（第三版）,刘东; 梁栋黎,,南京大学出版社,,
微观经济学: 中级教程,张元鹏,2015,北京大学出版社,978-7-301-25621-3,
微观经济学教程(第三版),刘东; 路瑶,2016,科学出版社,978-7-03-047815-3,
计量经济学导论（第五版）,杰弗里·M·伍德里奇,2015,中国人民大学出版社,978-7-300-20815-2,
计量经济学（第二版）,詹姆斯·H·斯托克; 马克·W·沃森,2012,格致出版社/上海三联书店/上海人民出版社,978-7-5432-2059-1,
Introduction to Econometrics,"STOCK, JAMES; WATSON, MARK",2017,PEARSON INDIA,978-93-5286-350-1,
精通计量：从原因到结果的探寻之旅,乔舒亚·安格里斯特; 约恩-斯特芬·皮施克,2019,格致出版社,978-7-5432-2764-4,
An Introduction to Game Theory,"Osborne, Martin J.",2003,Oxford University Press,978-0-19-512895-6,
ECONOMETRICS,"HANSEN, BRUCE E.",2021,,,
INTRODUCTION TO ECONOMETRICS,"HANSEN, BRUCE E.",2021,,,
薛兆丰经济学讲义,薛兆丰,2018,中信出版集团,978-7-5086-8551-9,
财务报表分析与证券投资,姜国华,2008,北京大学出版社,978-7-301-13798-7,
经济计量学精要（第四版）习题集,"古扎拉蒂, 达摩达尔·N·",2010,机械工业出版社,,
经济计量学精要,"古扎拉蒂, 达莫达尔·N; 波特",2010,机械工业出版社,978-7-111-30817-1,
概率论与数理统计教程,茆诗松; 程依明; 濮晓龙,2011,高等教育出版社,978-7-04-031210-2,
平狄克《微观经济学》（第8版）笔记和课后习题详解（修订版）,圣才考研网,2018,中国石化出版社,978-7-5114-4731-9,
考博英语全项指导（第十三版）,,2019,机械工业出版社,,
考博英语作文万能模板（第4版）,,2019,机械工业出版社,,
考博英语阅读理解精粹100篇（第13版）,,2019,机械工业出版社,,
考博英语名校真题精解及全真预测试卷（第5版）,,2019,机械工业出版社,,
4周攻克考博英语写译（第5版）,,2018,机械工业出版社,,
4周攻克考博英语听力、词汇、完形、改错周计划（第4版）,,2018,机械工业出版社,,
《微观经济学:现代观点》（第 9 版）笔记和课后习题详解,圣才考研网,,,,
中级微观经济学：现代方法（第 8 版）完美翻译版,曹乾,2013,,,
多恩布什《宏观经济学》（第12版）笔记和课后习题详解,圣才考研网,,,,
Using R for Introductory Econometrics,"Heiss, Florian",2020,Independently published,9.79865E+12,
计量经济分析,威廉·H·格林,2011,中国人民大学出版社,978-7-300-12779-8,
计量经济学导论：现代观点（第六版）,杰弗里·M·伍德里奇,2018,中国人民大学出版社,978-7-300-25914-7,
金融时间序列分析讲义,李东风,,,,
宏观经济学教程,叶航; 何樟勇; 李建琴,2016,浙江大学出版社,978-7-308-16229-6,